{
  "apiVersion": 1,
  "contract": "cartograph.adapter",
  "mediaType": "application/vnd.cartograph.adapter+json",
  "id": "cartograph.sample",
  "version": "0.1.0",
  "compatibilityVersion": 1,
  "capabilityRegistryVersion": 1,
  "capabilities": [
    {
      "id": "sample.fixture",
      "description": "Produces deterministic graph, evidence, identity, and unsupported-diagnostic fixtures.",
      "diagnosticCodes": ["UNSUPPORTED_SAMPLE_CONSTRUCT"],
      "confidence": ["certain", "inferred"],
      "examples": [
        "A supported fixture with one evidence-backed edge.",
        "An unsupported fixture with a reviewable diagnostic."
      ]
    }
  ],
  "execution": {
    "filesystem": "source-read-only",
    "network": false,
    "childProcess": false,
    "dynamicModuleLoading": false,
    "repositoryCodeExecution": false
  }
}
